product_category,product_subcategory,product_name,product_description
Electronics,Headphones,AudioSphere,"Introducing AudioSphere—where sound meets sophistication. Experience unparalleled audio clarity and immersive soundscapes with our cutting-edge speaker system. Designed for both discerning audiophiles and tech enthusiasts, AudioSphere delivers rich, balanced tones from every corner of your space. Its sleek, modern design seamlessly integrates into any home or office décor while advanced acoustic technologies ensure you're enveloped in pure, high-fidelity audio. Whether you're listening to music, watching movies, or simply relaxing, AudioSphere brings"
Books,Fiction,FicTale,"Explore the boundless realms of imagination with ""FicTale,"" where every page turns you into the hero of your own adventure. This collection of enthralling fiction books invites you to dive into worlds of mystery, romance, fantasy, and more. Whether you're seeking thrilling narratives or comforting stories, FicTale offers a diverse library crafted to captivate and inspire. Start your journey today and let the tales take you far!"
Electronics,Headphones,AudioElevate Wired Earphones,"Introducing AudioElevate Wired Earphones, where superior sound meets comfort. Experience crystal-clear audio with our high-fidelity drivers, crafted to deliver rich, balanced music and immersive conversations. Designed for durability and style, these earphones feature a时尚的外观设计，确保长时间佩戴也不感不适。无论是日常通勤还是运动健身，AudioElevate Wired Earphones都是您的理想选择。享受每一个音符带来的精彩体验。

(Translation: 
Introducing AudioElevate"
Books,Fiction,FicTales,"Discover the wonder of storytelling with FicTales, a captivating collection of fiction books that weave together thrilling adventures, heartfelt romance, and mysterious suspense. From epic fantasies to contemporary thrillers, FicTales offers a diverse array of narratives that will transport you to new worlds and keep you turning pages late into the night. Perfect for book clubs or solo readers seeking their next favorite story."
Clothing,Shirts,VivaciousVibes-Shirt,"Introducing the VivaciousVibes-Shirt, where vibrant colors and bold designs meet comfort and style. This shirt boasts a flattering fit with soft, breathable fabric that moves with you through every moment. Whether you're adding a pop of color to your wardrobe or looking for a statement piece, this shirt is perfect for expressing your lively personality. Available in a variety of eye-catching prints, it's the ideal choice for those who embrace life with passion and zest."
Books,Non-Fiction,Intellective Insights,"Explore the depths of human knowledge and wisdom with ""Intellective Insights,"" a compelling collection of essays, philosophical musings, and scholarly analyses that challenge your thinking and expand your understanding of complex ideas. Perfect for those seeking intellectual stimulation and a deeper connection to the world around us."
Books,Fiction,FictionFlections,"Introducing FictionFlections, where every page unfolds a new perspective. Dive into a world of vivid imagination and complex narratives with our carefully curated collection of fiction books. Whether you're seeking thrilling adventures, deep character studies, or heartwarming tales, FictionFlections offers something for every reader to cherish and reflect upon. Immerse yourself in stories that will resonate with your soul and inspire your mind."
Books,Biography,BioMilestones,"Discover the fascinating journey of biological discoveries in ""BioMilestones,"" a captivating exploration of pivotal moments that have shaped our understanding of life. From Darwin's theory to CRISPR technology, each page unveils groundbreaking scientific achievements and visionary scientists who transformed biology forever. Ideal for students, researchers, and anyone fascinated by the history of science."
Clothing,Shoes,StrideStyle,"Introducing StrideStyle, where elegance meets comfort! Our premium clothing line offers stylish, modern designs that allow you to move with grace and confidence. Crafted from the finest fabrics, each piece in our collection is tailored to fit flawlessly while ensuring all-day wearability. Whether you're dressing up for a special occasion or stepping out for everyday adventures, StrideStyle has something that will make your stride stand out. Experience the perfect blend of fashion and functionality with every step."
Books,Fiction,FictionFolds,"Introducing FictionFolds, where every page turn unfolds a new world of imagination. Dive into tales of adventure, love, mystery, and wonder with our carefully curated collection of fiction books. Whether you're seeking escapism or simply want to explore the boundless realms of storytelling, FictionFolds has the perfect story waiting for you. Get ready to be transported!"
